{"approvals":[{"approved_at":"2026-06-01T12:00:00Z","assignment_ref":{"artifact_path":"contracts/fixtures/governance-models/valid/owner-assignment.json","artifact_sha256":"602ba552f113d6403c4a07e42982d2c035c9b52e64dfc595158629d486359740","authority_id":"fixture-owner-assignment-r1","revision":1,"verified_at":"2026-06-01T12:01:00Z"},"decision":"SYNTHETIC_ONLY","principal_id":"fixture-release-owner-person","role_id":"release-owner"}],"artifact_id":"fixture-owner-assignment-r1","artifact_metadata":{"classification":"SYNTHETIC_FIXTURE","evidence_claim":"NOT_EVIDENCE_OR_PASS","fixture_notice":"SYNTHETIC EXAMPLE ONLY; NOT EVIDENCE; NOT A PASS VERDICT"},"assignments":[{"accountable_party_id":"fixture-release-owner-person","assignment_status":"RESOLVED","authorization_scope":["synthetic-governance-fixture"],"blocker":null,"compensating_controls":[],"conflict_predicates":[{"authority_ref":{"authority_kind":"fixture-oracle","locator":"contracts/fixtures/governance-models/support/release-owner-conflict-authority.json","ref_id":"release-owner-conflict-authority","sha256":"2c093000035c0324750a64fce1fee90c7f17bd903dcbee6993562400c3ee6955"},"evaluated_at":"2026-06-01T12:00:00Z","outcome":"NO_CONFLICT","predicate_id":"release-owner-conflict-check","statement":"Synthetic fixture conflict check."}],"effective_at":"2026-01-01T00:00:00Z","executor_id":"fixture-release-owner-person","expires_at":"2027-01-01T00:00:00Z","last_verified_at":"2026-06-01T12:00:00Z","party_type":"person","required_approval_roles":["release-owner"],"reviewer_id":"fixture-independent-reviewer","role_id":"release-owner"},{"accountable_party_id":"fixture-contract-owner-person","assignment_status":"RESOLVED","authorization_scope":["synthetic-governance-fixture"],"blocker":null,"compensating_controls":[],"conflict_predicates":[{"authority_ref":{"authority_kind":"fixture-oracle","locator":"contracts/fixtures/governance-models/support/contract-owner-conflict-authority.json","ref_id":"contract-owner-conflict-authority","sha256":"03f5df88d61ec6c41b5a133d600d62ff5d58382a081edb8688389cb7d8dc52b6"},"evaluated_at":"2026-06-01T12:00:00Z","outcome":"NO_CONFLICT","predicate_id":"contract-owner-conflict-check","statement":"Synthetic fixture conflict check."}],"effective_at":"2026-01-01T00:00:00Z","executor_id":"fixture-contract-owner-person","expires_at":"2027-01-01T00:00:00Z","last_verified_at":"2026-06-01T12:00:00Z","party_type":"person","required_approval_roles":["release-owner"],"reviewer_id":"fixture-independent-reviewer","role_id":"contract-owner"},{"accountable_party_id":"fixture-capture-owner-person","assignment_status":"RESOLVED","authorization_scope":["synthetic-governance-fixture"],"blocker":null,"compensating_controls":[],"conflict_predicates":[{"authority_ref":{"authority_kind":"fixture-oracle","locator":"contracts/fixtures/governance-models/support/capture-owner-conflict-authority.json","ref_id":"capture-owner-conflict-authority","sha256":"776c6e7e9176fa256c5beded71a28d617a54c39157d771377891e3b81c627ea9"},"evaluated_at":"2026-06-01T12:00:00Z","outcome":"NO_CONFLICT","predicate_id":"capture-owner-conflict-check","statement":"Synthetic fixture conflict check."}],"effective_at":"2026-01-01T00:00:00Z","executor_id":"fixture-capture-owner-person","expires_at":"2027-01-01T00:00:00Z","last_verified_at":"2026-06-01T12:00:00Z","party_type":"person","required_approval_roles":["release-owner"],"reviewer_id":"fixture-independent-reviewer","role_id":"capture-owner"},{"accountable_party_id":"fixture-consumer-owner-person","assignment_status":"RESOLVED","authorization_scope":["synthetic-governance-fixture"],"blocker":null,"compensating_controls":[],"conflict_predicates":[{"authority_ref":{"authority_kind":"fixture-oracle","locator":"contracts/fixtures/governance-models/support/consumer-owner-conflict-authority.json","ref_id":"consumer-owner-conflict-authority","sha256":"7d405f9903db75a644a757ec1a09c770d8e36269be74d0964b195d5433dff914"},"evaluated_at":"2026-06-01T12:00:00Z","outcome":"NO_CONFLICT","predicate_id":"consumer-owner-conflict-check","statement":"Synthetic fixture conflict check."}],"effective_at":"2026-01-01T00:00:00Z","executor_id":"fixture-consumer-owner-person","expires_at":"2027-01-01T00:00:00Z","last_verified_at":"2026-06-01T12:00:00Z","party_type":"person","required_approval_roles":["release-owner"],"reviewer_id":"fixture-independent-reviewer","role_id":"consumer-owner"},{"accountable_party_id":"fixture-web-control-owner-person","assignment_status":"RESOLVED","authorization_scope":["synthetic-governance-fixture"],"blocker":null,"compensating_controls":[],"conflict_predicates":[{"authority_ref":{"authority_kind":"fixture-oracle","locator":"contracts/fixtures/governance-models/support/web-control-owner-conflict-authority.json","ref_id":"web-control-owner-conflict-authority","sha256":"2845969efbab8128d236d773109f2c45c06fc87bdfeb91ad2f9717dee2e03caf"},"evaluated_at":"2026-06-01T12:00:00Z","outcome":"NO_CONFLICT","predicate_id":"web-control-owner-conflict-check","statement":"Synthetic fixture conflict check."}],"effective_at":"2026-01-01T00:00:00Z","executor_id":"fixture-web-control-owner-person","expires_at":"2027-01-01T00:00:00Z","last_verified_at":"2026-06-01T12:00:00Z","party_type":"person","required_approval_roles":["release-owner"],"reviewer_id":"fixture-independent-reviewer","role_id":"web-control-owner"},{"accountable_party_id":"fixture-network-owner-person","assignment_status":"RESOLVED","authorization_scope":["synthetic-governance-fixture"],"blocker":null,"compensating_controls":[],"conflict_predicates":[{"authority_ref":{"authority_kind":"fixture-oracle","locator":"contracts/fixtures/governance-models/support/network-owner-conflict-authority.json","ref_id":"network-owner-conflict-authority","sha256":"a19f3f57884dedd5ac9a4d6caaafc8ee0c08eaebe5c9215c95bd62ca13c8728a"},"evaluated_at":"2026-06-01T12:00:00Z","outcome":"NO_CONFLICT","predicate_id":"network-owner-conflict-check","statement":"Synthetic fixture conflict check."}],"effective_at":"2026-01-01T00:00:00Z","executor_id":"fixture-network-owner-person","expires_at":"2027-01-01T00:00:00Z","last_verified_at":"2026-06-01T12:00:00Z","party_type":"person","required_approval_roles":["release-owner"],"reviewer_id":"fixture-independent-reviewer","role_id":"network-owner"},{"accountable_party_id":"fixture-security-owner-person","assignment_status":"RESOLVED","authorization_scope":["synthetic-governance-fixture"],"blocker":null,"compensating_controls":[],"conflict_predicates":[{"authority_ref":{"authority_kind":"fixture-oracle","locator":"contracts/fixtures/governance-models/support/security-owner-conflict-authority.json","ref_id":"security-owner-conflict-authority","sha256":"0dcb5fb7f3ad35dfd63322a4a1a2e60d2ccdd7283684893b8a922de12929bbdb"},"evaluated_at":"2026-06-01T12:00:00Z","outcome":"NO_CONFLICT","predicate_id":"security-owner-conflict-check","statement":"Synthetic fixture conflict check."}],"effective_at":"2026-01-01T00:00:00Z","executor_id":"fixture-security-owner-person","expires_at":"2027-01-01T00:00:00Z","last_verified_at":"2026-06-01T12:00:00Z","party_type":"person","required_approval_roles":["release-owner"],"reviewer_id":"fixture-independent-reviewer","role_id":"security-owner"},{"accountable_party_id":"fixture-build-platform-owner-person","assignment_status":"RESOLVED","authorization_scope":["synthetic-governance-fixture"],"blocker":null,"compensating_controls":[],"conflict_predicates":[{"authority_ref":{"authority_kind":"fixture-oracle","locator":"contracts/fixtures/governance-models/support/build-platform-owner-conflict-authority.json","ref_id":"build-platform-owner-conflict-authority","sha256":"3e8273cff8321a650c9f26204d8c596c65e49e8ae67f2aed576f1f3561a677c1"},"evaluated_at":"2026-06-01T12:00:00Z","outcome":"NO_CONFLICT","predicate_id":"build-platform-owner-conflict-check","statement":"Synthetic fixture conflict check."}],"effective_at":"2026-01-01T00:00:00Z","executor_id":"fixture-build-platform-owner-person","expires_at":"2027-01-01T00:00:00Z","last_verified_at":"2026-06-01T12:00:00Z","party_type":"person","required_approval_roles":["release-owner"],"reviewer_id":"fixture-independent-reviewer","role_id":"build-platform-owner"},{"accountable_party_id":"fixture-qa-evidence-owner-person","assignment_status":"RESOLVED","authorization_scope":["synthetic-governance-fixture"],"blocker":null,"compensating_controls":[],"conflict_predicates":[{"authority_ref":{"authority_kind":"fixture-oracle","locator":"contracts/fixtures/governance-models/support/qa-evidence-owner-conflict-authority.json","ref_id":"qa-evidence-owner-conflict-authority","sha256":"99eb7d9b52111481416e04d21332eaefa1859246ebb0e82413327778aef9235e"},"evaluated_at":"2026-06-01T12:00:00Z","outcome":"NO_CONFLICT","predicate_id":"qa-evidence-owner-conflict-check","statement":"Synthetic fixture conflict check."}],"effective_at":"2026-01-01T00:00:00Z","executor_id":"fixture-qa-evidence-owner-person","expires_at":"2027-01-01T00:00:00Z","last_verified_at":"2026-06-01T12:00:00Z","party_type":"person","required_approval_roles":["release-owner"],"reviewer_id":"fixture-independent-reviewer","role_id":"qa-evidence-owner"},{"accountable_party_id":"fixture-hardware-owner-person","assignment_status":"RESOLVED","authorization_scope":["synthetic-governance-fixture"],"blocker":null,"compensating_controls":[],"conflict_predicates":[{"authority_ref":{"authority_kind":"fixture-oracle","locator":"contracts/fixtures/governance-models/support/hardware-owner-conflict-authority.json","ref_id":"hardware-owner-conflict-authority","sha256":"fee4bd20aa1c76ed23c05e36ed3356a4167468f5d70ea031031151bb3d2ee876"},"evaluated_at":"2026-06-01T12:00:00Z","outcome":"NO_CONFLICT","predicate_id":"hardware-owner-conflict-check","statement":"Synthetic fixture conflict check."}],"effective_at":"2026-01-01T00:00:00Z","executor_id":"fixture-hardware-owner-person","expires_at":"2027-01-01T00:00:00Z","last_verified_at":"2026-06-01T12:00:00Z","party_type":"person","required_approval_role